source,leaf,paths
Patient with OBESITY,Tests to rule out endocrine causes,"Root node representing a patient with obesity -> Gather patient history including rate of weight gain, dietary history, caloric expenditure, prescribed diet for successful weight loss, recently quit smoking, endocrine features (cold, constipation, hair change, virilization, striae, buffalo hump) -> Tests to rule out endocrine causes"
Patient with OBESITY,Counsel regarding diet/exercise to ideal BMI (23),Root node representing a patient with obesity -> Measure BMI and waist circumference -> Management of the patient -> Counsel regarding diet/exercise to ideal BMI (23)
Patient with OBESITY,Check lipids and glucose. Control blood pressure. Make a dietary plan and follow-up,Root node representing a patient with obesity -> Measure BMI and waist circumference -> Management of the patient -> Check lipids and glucose. Control blood pressure. Make a dietary plan and follow-up
Patient with OBESITY,"Check fasting lipids and glucose. Control blood pressure. Make a dietary plan and follow-up. If unsuccessful or if elevated glucose or lipids, consider supplemental medication","Root node representing a patient with obesity -> Measure BMI and waist circumference -> Management of the patient -> Check fasting lipids and glucose. Control blood pressure. Make a dietary plan and follow-up. If unsuccessful or if elevated glucose or lipids, consider supplemental medication"
Patient with OBESITY,"See BMI 30-35. If osteoarthritis present, consider low-impact exercise alternatives","Root node representing a patient with obesity -> Measure BMI and waist circumference -> Management of the patient -> See BMI 30-35. If osteoarthritis present, consider low-impact exercise alternatives"
Patient with OBESITY,"Try all modalities. If unsuccessful, consider bariatric surgery","Root node representing a patient with obesity -> Measure BMI and waist circumference -> Management of the patient -> Try all modalities. If unsuccessful, consider bariatric surgery"
