name,zero_shot,real,question,path
contraceptive choices,"**D.** Here's why:* **The patient's allergy to nonoxynol-9** eliminates options A, C, and E (which often use spermicides containing nonoxynol-9).* **Combination oral contraceptives** are highly effective and don't require active participation during intercourse. Let me know if you have any other questions!",B,A 28-year-old male with multiple sexual partners and allergy to nonoxynol-9 requests contraception advice. Which of the following contraceptive methods is MOST appropriate for his female partner?,"Decision tree for contraceptive choice -> Reversible contraceptive methods -> Methods avoiding nonoxynol-9 -> Intrauterine device -> Copper IUD recommended for long-acting, hormone-free contraception"
use of oral contraceptives,C,D,"A 28-year-old woman, who has been on a monophasic oral contraceptive pill for 3 months, reports missing her last two menstrual cycles and is not pregnant. After ruling out other causes, what is the MOST appropriate next step in managing her OC-related amenorrhea?",Counsel patient -> Monitor for 3 months -> Recognize that amenorrhea can be a normal side effect of OC use -> Reassure patient and continue current regimen
use of oral contraceptives,C,B,"A 28-year-old woman started using combined oral contraceptives (COCs) three months ago and reports persistent nausea despite taking the pill with food. Her blood pressure is normal, and she has no other side effects. What is the most appropriate next step in managing her nausea related to COC use?",Counsel patient -> Monitor for 3 months -> Persistent nausea despite taking with food warrants symptomatic treatment -> Prescribe an antiemetic while continuing current regimen
use and evaluation of vancomycin serum drug level,C,A,"A 28-year-old woman requests oral contraceptives for birth control. She has no significant past medical history and is a non-smoker. After discussing the risks and benefits and ruling out contraindications, which of the following is the most appropriate next step in managing her contraceptive needs?","Counsel patient -> Evaluate medical history and contraindications -> For a healthy young woman, combined OC is first-line -> Schedule follow-up in 3 months for side effect review and BP check"
anemia,E,B,"A 30-year-old male presents with fatigue and pallor. Lab results indicate normovolemic anemia with increased reticulocytes, a negative Coombs' test, and no splenomegaly. Assuming other common causes have been ruled out, which of the following is the MOST likely cause of his anemia?",Patient with anemia -> Normovolemic -> Increased reticulocytes -> Negative Coombs' test -> No splenomegaly -> Likely acquired hemolytic anemia due to extrinsic factors.
use and evaluation of serum drug levels,E,B,"A 58-year-old male presents with fatigue and pallor. His CBC reveals anemia with normal MCV, normal RDW and decreased reticulocyte count. Further analysis shows macrocytosis, and normal levels of vitamin B12 and folate. What is the MOST appropriate next step in evaluating the cause of his anemia?",Patient with anemia -> Normovolemic -> Decreased reticulocytes -> Macrocytic RBCs -> Normal vitamin B12 and folate -> Concern for marrow pathology -> Bone marrow aspiration and biopsy.
secondary amenorrhea,B,A,"A 28-year-old woman with a history of regular menses presents to your office reporting absence of menses for the past 7 months. She is not pregnant. After withdrawal bleeding from an Estrogen and Progestin Challenge, her LH and FSH levels are found to be within the normal range. An MRI of the head comes back normal. A progestin challenge test is performed, and no withdrawal bleeding occurs. Following this, an estrogen and progestin challenge test is administered, resulting in withdrawal bleeding. What is the most likely diagnosis, and what further investigations should be considered?","Secondary amenorrhea evaluation -> Negative progestin challenge with positive estrogen–progestin challenge indicates anovulatory cycles -> Further evaluation should target causes of anovulation, such as PCOS, via endocrine workup."
weakness,"**E** Here's why:* **The key features are:*** Progressive weakness* Atrophy and fasciculations (indicating lower motor neuron involvement)* Diminished reflexes* No sensory deficits* **These findings strongly suggest a problem at the neuromuscular junction (NMJ), where nerves communicate with muscles.** Let's look at why the other options are less likely:* **A. Upper motor neuron lesion:** Would typically present with spasticity, increased reflexes, and weakness that affects both sides of the body.* **B. Spinal cord compression:**",D,"A 58-year-old male presents with progressive weakness in his right arm over the past 6 months. On examination, the patient exhibits atrophy and fasciculations in the affected arm, with diminished reflexes but no sensory deficits. What is the most likely underlying cause of the patient's weakness?","Chronic progressive LMN signs (atrophy, fasciculations) without sensory involvement are characteristic of ALS."
prevention and screening,"**D.** Here's why:* **Tricuspid stenosis** is the most likely cause of an early diastolic, decrescendo murmur heard best at the left lower sternal border that increases with inspiration.Let me explain:* **Early Diastolic Murmur:** This indicates blood flow obstruction during ventricular relaxation (diastole).* **Decrescendo Configuration:** The murmur gets softer as it progresses through diastole.* **Left Lower Sternal Border:** This location is characteristic of tricuspid valve sounds.* **Inspiration Increases Intensity:**Increased venous return during inspiration can",B,"A 54-year-old woman is evaluated for a diastolic murmur. The murmur is early diastolic with a decrescendo configuration, heard best at the left lower sternal border, and increases in intensity with inspiration. Which of the following is the most likely underlying cause?",Patient with diastolic murmur -> Early diastolic decrescendo sound -> Right-sided murmur (increases with inspiration) -> Consistent with pulmonic regurgitation
prevention and screening,"The correct answer is **A**. Here's why:* **Lipid disorder screening:**Recommended for women starting at age 45, according to guidelines.Let's look at the other options:* **B. Colorectal cancer screening:** Recommended starting at age 45, so this is appropriate.* **C. Annual influenza vaccination:** Recommended annually for everyone over 6 months of age.* **D. Pneumococcal vaccination:**Recommended for adults over 65 and those with certain risk factors. While she's approaching the age for routine pneumococcal vaccination, it'",C,"A 55-year-old woman with no significant past medical history presents to your office for a routine check-up. She is generally healthy and has no specific complaints. Considering her age and sex, which of the following preventive measures should be recommended according to the guidelines?","Decision tree for preventive health services -> Age 50-64 -> Female -> For immunizations, the annual influenza vaccine is recommended; pneumococcal vaccine is for those ≥65 or with risk factors."
